{
  "serviceId": "M1876",
  "name": "Kindergarten Registration",
  "identifier": "http://localhost:8080/IFE/kindergaten_registration.html",
  "issued": "",
  "createdByUserId": "",
  "serviceDescriptionVersion": "v0.3",
  "serviceIconUrl": "https://i.pinimg.com/564x/a6/b8/d2/a6b8d20a0e2f36df01382439a2e8a932.jpg",
  "status": "Completed",
  "supportedProfiles": [
    "consenting",
    "3rd party re-use",
    "notification",
    "objection"
  ],
  "spatial": "ITA-Italy",
  "lifeEvent": "Starting education",
  "businessEvent": "",
  "sector": [],
  "type": [
    "10.4 - Family and children"
  ],
  "thematicArea": [
    "10.4 - Family and children"
  ],
  "language": [
    "en",
    "fr-fr",
    "it"
  ],
  "hasCompetentAuthority": {
    "prefLabel": "Municipality Of",
    "spatial": "ITA-Italy"
  },
  "humanReadableDescription": [
    {
      "locale": "en",
      "description": "E-service form for kindergaten Registration ",
      "keyword": []
    }
  ],
  "serviceInstance": {
    "serviceProvider": {
      "businessId": "",
      "name": "",
      "address1": "",
      "address2": "",
      "postalcode": "",
      "city": "",
      "state": "",
      "country": "",
      "email": "",
      "phone": "",
      "jurisdiction": ""
    },
    "cert": {
      "x5u": ""
    },
    "serviceUrls": {
      "domain": "https://localhost:8080/",
      "libraryDomain": "",
      "linkingUri": "",
      "linkingRedirectUri": "",
      "objectionUri": "",
      "notificationUri": ""
    },
    "dataController": {
      "piiController": "Controller Name",
      "onBehalf": false,
      "org": "PA NAme",
      "contact": "contact Name",
      "address": "address 123",
      "email": "mail@pa.it",
      "phone": "123"
    }
  },
  "isDescribedAt": [
    {
      "datasetId": "Contacts",
      "description": [
        {
          "locale": "en",
          "description": "Contact Info",
          "keyword": []
        }
      ],
      "datasetSchema": {
        "context": "",
        "type": "",
        "id": ""
      },
      "dataStructureSpecification": "",
      "distribution": {
        "distributionId": "",
        "accessUrl": "",
        "description": [],
        "format": ""
      },
      "dataMapping": [
        {
          "property": "AventeTitolo_Fax",
          "conceptId": "fax_number_for_support",
          "name": "Fax Number",
          "type": "text",
          "required": 0,
          "sensitive": 0
        },
        {
          "property": "AventeTitolo_EMail",
          "conceptId": "personal_email",
          "name": "Email",
          "type": "text",
          "required": 0,
          "sensitive": 0
        },
        {
          "property": "AventeTitolo_EMailPEC",
          "conceptId": "personal_other_email",
          "name": "Other Email",
          "type": "text",
          "required": 0,
          "sensitive": 0
        },
        {
          "property": "AventeTitolo_Telefono",
          "conceptId": "phone_number",
          "name": "Phone Number",
          "type": "text",
          "required": 0,
          "sensitive": 0
        }
      ]
    },
    {
      "datasetId": "ChildInfo",
      "description": [
        {
          "locale": "en",
          "description": "Child info",
          "keyword": []
        }
      ],
      "datasetSchema": {
        "context": "",
        "type": "",
        "id": ""
      },
      "dataStructureSpecification": "",
      "distribution": {
        "distributionId": "",
        "accessUrl": "",
        "description": [],
        "format": ""
      },
      "dataMapping": [
        {
          "property": "AventeTitolo_EnteProvv",
          "conceptId": "child_custodial_body",
          "name": "Child Custodial Body",
          "type": "text",
          "required": 1,
          "sensitive": 0
        },
        {
          "property": "AventeTitolo_NumProt",
          "conceptId": "child_custodial_protocol",
          "name": "Child Custodial Protocol",
          "type": "text",
          "required": 1,
          "sensitive": 0
        },
        {
          "property": "AventeTitolo_Data",
          "conceptId": "child_custodial_date",
          "name": "Child Custodial Date",
          "type": "text",
          "required": 1,
          "sensitive": 0
        },
        {
          "property": "Name",
          "conceptId": "preferred_first_name",
          "name": "First Name",
          "type": "text",
          "required": 1,
          "sensitive": 0
        },
        {
          "property": "Sex",
          "conceptId": "birth_certificate_sex",
          "name": "Sex",
          "type": "text",
          "required": 1,
          "sensitive": 0
        },
        {
          "property": "birth",
          "conceptId": "birthday_birthday",
          "name": "Birthday",
          "type": "text",
          "required": 1,
          "sensitive": 0
        }
      ]
    },
    {
      "datasetId": "Father",
      "description": [
        {
          "locale": "en",
          "description": "Father Information",
          "keyword": []
        }
      ],
      "datasetSchema": {
        "context": "",
        "type": "",
        "id": ""
      },
      "dataStructureSpecification": "",
      "distribution": {
        "distributionId": "",
        "accessUrl": "",
        "description": [],
        "format": ""
      },
      "dataMapping": [
        {
          "property": "Parametri_TipoLavoroPadre",
          "conceptId": "work_industry",
          "name": "Work Industry",
          "type": "text",
          "required": 1,
          "sensitive": 0
        },
        {
          "property": "Parametri_AziendaLavoroPadre",
          "conceptId": "work_company",
          "name": "Work Company",
          "type": "text",
          "required": 1,
          "sensitive": 0
        },
        {
          "property": "Parametri_ComuneAziendaLavoroPadre",
          "conceptId": "work_current_employer_city",
          "name": "Work City",
          "type": "text",
          "required": 1,
          "sensitive": 0
        },
        {
          "property": "Parametri_ProvAziendaLavoroPadre",
          "conceptId": "work_current_employer_province",
          "name": "Work Province",
          "type": "text",
          "required": 1,
          "sensitive": 0
        },
        {
          "property": "Parametri_IndirizzoAziendaLavoroPadre",
          "conceptId": "work_current_employer_address",
          "name": "Work Address",
          "type": "text",
          "required": 1,
          "sensitive": 0
        },
        {
          "property": "Parametri_CivicoAziendaLavoroPadre",
          "conceptId": "work_current_employer_street_number",
          "name": "Work Post Code",
          "type": "text",
          "required": 1,
          "sensitive": 0
        },
        {
          "property": "Parametri_CapAziendaLavoroPadre",
          "conceptId": "work_current_employer_post_code",
          "name": "Work Post Code",
          "type": "text",
          "required": 1,
          "sensitive": 0
        },
        {
          "property": "Parametri_TelAziendaLavoroPadre",
          "conceptId": "work_current_employer_phone",
          "name": "Work Phone",
          "type": "text",
          "required": 1,
          "sensitive": 0
        },
        {
          "property": "Parametri_EmailAziendaLavoroPadre",
          "conceptId": "work_current_employer_email",
          "name": "Work Email",
          "type": "text",
          "required": 1,
          "sensitive": 0
        },
        {
          "property": "Parametri_AgenziaEntratePadre",
          "conceptId": "work_current_employer_revenue_agency",
          "name": "Work Revenue Agency",
          "type": "text",
          "required": 1,
          "sensitive": 0
        },
        {
          "property": "name",
          "conceptId": "preferred_first_name",
          "name": "First Name",
          "type": "text",
          "required": 1,
          "sensitive": 0
        },
        {
          "property": "lastname",
          "conceptId": "preferred_last_name",
          "name": "Last Name",
          "type": "text",
          "required": 1,
          "sensitive": 0
        }
      ]
    },
    {
      "datasetId": "Mother",
      "description": [
        {
          "locale": "en",
          "description": "Mother Info",
          "keyword": []
        }
      ],
      "datasetSchema": {
        "context": "",
        "type": "",
        "id": ""
      },
      "dataStructureSpecification": "",
      "distribution": {
        "distributionId": "",
        "accessUrl": "",
        "description": [],
        "format": ""
      },
      "dataMapping": [
        {
          "property": "Name",
          "conceptId": "preferred_first_name",
          "name": "First Name",
          "type": "text",
          "required": 1,
          "sensitive": 0
        },
        {
          "property": "lastname",
          "conceptId": "preferred_last_name",
          "name": "Last Name",
          "type": "text",
          "required": 1,
          "sensitive": 0
        },
        {
          "property": "Parametri_PIVAMadre",
          "conceptId": "work_current_employer_vat",
          "name": "Work VAT",
          "type": "text",
          "required": 1,
          "sensitive": 0
        },
        {
          "property": "Parametri_TipoLavoroMadre",
          "conceptId": "work_industry",
          "name": "Work Industry",
          "type": "text",
          "required": 1,
          "sensitive": 0
        },
        {
          "property": "Parametri_AziendaLavoroMadre",
          "conceptId": "work_company",
          "name": "Work Company",
          "type": "text",
          "required": 1,
          "sensitive": 0
        },
        {
          "property": "Parametri_ComuneAziendaLavoroMadre",
          "conceptId": "work_current_employer_city",
          "name": "Work City",
          "type": "text",